{
  "schema_version": "slot-alignment.parameter-authority.v6",
  "task_id": "<task-id>",
  "frozen_before_candidate": true,
  "status": "READY",
  "default_rules": {
    "reel_strip_weight_changes_authorized": true,
    "reel_axis_geometry_symbol_domain_and_game_semantics_locked": true,
    "structure_change_requires_explicit_user_authorization": true
  },
  "parameters": [
    {
      "parameter_id": "<parameter-id>",
      "name_zh": "<中文名称>",
      "runtime_path": "<runtime-json-path>",
      "value_type": "integer_weights",
      "authorization": "authorized",
      "operations": ["set", "scale"],
      "minimum": 0,
      "maximum": 1000000,
      "structure_change": false,
      "evidence_refs": ["<evidence-ref>"]
    }
  ],
  "placeholders": [],
  "authorized_at": "<ISO-8601>"
}
